idea,keyphrase
"Channeling Oscar Wilde’s wit into Kubernetes pod annotations","k8s pod annotations wit"
"Jack Kerouac‑style road trip through microservices dependencies","microservices road trip"
"Janis Joplin levels of performance tuning for high‑load APIs","api performance tuning joplin"
"Write Python code as elegantly as Wilde penned his epigrams","python code elegance"
"Hit the digital highway like Kerouac: automating log aggregation","log aggregation automation"
"Bring Joplin’s raw energy to your CI/CD pipelines","ci/cd pipeline energy"
"Infuse Wildean aphorisms into your commit messages","commit messages aphorisms"
"Beatnik‑inspired dev workflow: Python scripts and jazz breaks","beatnik dev workflow"
"Design a Kubernetes Operator with the spontaneity of On the Road","operator spontaneity"
"Optimize database queries with the soul of Janis’s voice","query optimization soul"
"Craft a graph database schema as Wilde crafted a paradox","graph schema paradox"
"Kerouac‑driven continuous delivery: code like it’s a rolling narrative","continuous delivery narrative"
"Build an AI chatbot that quotes Wilde at opportune moments","ai chatbot wilde quotes"
"Live‑reload your code with the improvisation of a blues solo","live reload improvisation"
"Use Python to orchestrate cloud resources with Kerouac’s wanderlust","cloud orchestration wanderlust"
"Janis Joplin flair: auto‑scaling Kubernetes under heavy load","k8s autoscaling flair"
"Embed Wilde’s dramatic irony into your error‑handling patterns","error handling irony"
"Beat generation of network graphs: visualize traffic like prose","network graph visualization"
"Janis Joplin’s passion in your container health checks","container health passion"
"Write Helm charts with the poetic rhythm of On the Road","helm charts rhythm"
"AI‑powered log summaries as epigrams, in Wilde’s style","log summaries epigrams"
"Kerouac’s stream‑of‑consciousness for Python REPL sessions","python repl flow"
"Joplin‑worthy alerting: scream when your metrics spike","metrics alerting scream"
"Use Wildean paradoxes to document your API design","api design paradox"
"Automate your blog like Kerouac scribbled notebooks on the run","blog automation beatnik"
"Janis Joplin’s gritty authenticity in your Docker builds","docker build authenticity"
"Craft a knowledge graph that reads like Wilde’s aphorisms","knowledge graph aphorisms"
"Wilde‑inspired UX: augment your Grafana dashboards with wit","grafana wit ux"
"Kerouac‑style CLI: build a travelogue interface for your scripts","cli travelogue interface"
"Infuse Joplin’s soul‑shaking vocals into Kubernetes security policies","k8s security soul"
"James: The Portrait of a Cluster, When Young","portrait of a cluster"
"The Portrait of a Kubernetes Grey: Uncovering the Subtle Shades of Your Cluster’s Unsung Components","kubernetes grey portrait"
"Deploy a self‑hosted AI chatbot with Rasa on Kubernetes","self-hosted ai chatbot"
"Use Python and Pandas to analyze your Kubernetes cluster resource usage","k8s resource analysis python"
"Automate your home network backup using BorgBackup and CronJobs","home backup automation borg"
"Create a graph database of your microservices dependencies with Neo4j","microservices graph database"
"Visualize K8s pod restarts over time using Grafana and Prometheus","k8s monitoring grafana prometheus"
"Train a simple transformer in PyTorch to summarize Kubernetes logs","log summarization ai"
"Self‑host a TensorFlow Serving endpoint for real‑time inference","tensorflow serving self-hosted"
"Build a Python CLI tool with Click to manage Helm releases","helm cli python"
"Integrate OpenAI embeddings into a Flask app for semantic search","semantic search flask python"
"Use NetworkX to map network topology from your cloud provider’s API","network topology python graph"
"Write a Kubernetes Operator in Go vs Python: a side‑by‑side comparison","k8s operator go python"
"Set up a self‑hosted GitLab CI runner on Kubernetes","gitlab ci k8s runner"
"Build an AI‑driven bot that auto‑labels GitHub issues","github issue labeling ai"
"Deploy a private Docker registry with Harbor on Kubernetes","harbor private registry k8s"
"Create a self‑healing Redis cluster with Kubernetes StatefulSets","redis statefulset k8s"
"Use Python and Dask to parallelize your home data processing workflows","dask parallel python"
"Host your own vector‑search engine with Milvus and Python","milvus vector search self-hosted"
"Automate SSL certificate renewal on Kubernetes with Cert‑Manager","cert-manager k8s ssl"
"Monitor GPU usage inside K8s pods and send alerts via Slack","k8s gpu monitoring slack"
"Build a GraphQL API in Python for multi‑tenant SaaS dashboards","graphql saas python"
"Orchestrate self‑hosted Nextcloud backups using Kubernetes CronJobs","nextcloud backup k8s"
"Train a YOLO object‑detection model on Raspberry Pi with Python","yolo raspberry pi python"
"Deploy an ELK stack on Kubernetes for centralized log analysis","elk k8s deployment"
"Use Python’s FastAPI to serve AI models with async endpoints","fastapi ai serving"
"Create a knowledge graph of your DevOps docs using RDFLib","knowledge graph rdf python"
"Automate DNS failover with Kubernetes and ExternalDNS","dns automation k8s"
"Build a self‑hosted JupyterHub on Kubernetes for team data science","jupyterhub k8s self-hosted"
"Use Argo Workflows to parallelize your ML training pipelines","argo workflows ml"
"Set up a private Helm chart repository using ChartMuseum","private helm repo"
"Design a Kubernetes dynamic admission webhook in Python to enforce custom security policies","k8s admission webhook python"
"Automate solar‑aware EV charging with a custom k8s controller","solar-aware ev charging"
"Leverage Jack Kerouac’s spontaneity in your test‑driven development","tdd spontaneity"
"Infuse Janis Joplin’s soul into your database migration scripts","db migration passion"
"Write commit messages with Oscar Wilde‑style epigrams","commit epigrams"
"Build a Python script that auto‑generates Haiku from Kubernetes event logs","haiku k8s logs"
"Host a Grafana party: theming dashboards after rock legends","grafana theming party"
"Use Flask and WebSockets to stream live log lines like a Kerouac monologue","live log streaming flask"
"Create a serverless function that quotes Wilde on every deploy","wilde quotes deploy"
"Craft a Kafka stream processing pipeline with Joplin’s bravado","kafka stream bravado"
"Model your CI pipeline as a Beat poem with Python DSL","ci pipeline poem"
"Implement chaos engineering experiments inspired by Kerouac’s road detours","chaos engineering detours"
"Train a style‑transfer neural network to convert code to Wildean prose","code to prose style transfer"
"Use Kubernetes Namespaces as chapters in your microservices saga","k8s namespaces saga"
"Automate Markdown blog generation with Python and Wilde‑style flair","markdown blog automation"
"Deploy a self‑healing NGINX Ingress inspired by Joplin’s resilience","nginx ingress resilience"
"Plot container lifecycle events on a graph like Kerouac’s maps","container lifecycle graph"
"Host a local PyPI mirror in Kubernetes, titled ‘WildePy’","wildepy pypi mirror"
"Use Python’s asyncio to orchestrate a jazz‑inspired task scheduler","asyncio jazz scheduler"
"Implement a GraphQL federation that reads like On the Road’s chapters","graphql federation narrative"
"Create a CustomResourceDefinition named ‘WildeScript’ for dynamic scripting","widescript crd"
"Auto‑format your code with Black while quoting Wilde’s maxims","black formatting maxims"
"Monitor application latency with a Kerouac‑style visual theme","latency monitoring theme"